text,label
"Each party must keep all shared information strictly confidential.",Confidentiality
"Either party may terminate this agreement with prior written notice.",Termination
"Provider shall indemnify client against third-party claims.",Indemnity
"The agreement is governed by laws of India.",Governing Law
"Neither party is liable for indirect damages.",Liability
"Payment is due within fifteen days of invoice date.",Payment Terms
"Disputes shall be resolved through arbitration.",Dispute Resolution
"Force majeure events excuse delayed performance.",Force Majeure
